{
  "$schema": "http://json-schema.org/draft-07/schema#",
  "definitions": {
    "nonEmptyString": {
      "type": "string",
      "pattern": "^\\S(.*\\S)?$"
    },
    "versionString": {
      "type": "string",
      "pattern": "^[0-9]+\\.[0-9]+$"
    },
    "uuid": {
      "type": "string",
      "pattern": "^[0-9a-fA-F]{8}-[0-9a-fA-F]{4}-[0-9a-fA-F]{4}-[0-9a-fA-F]{4}-[0-9a-fA-F]{12}$"
    },
    "oddsString": {
      "type": "string",
      "pattern": "^[0-9]+:[0-9,]+$"
    },
    "productOdds": {
      "type": "object",
      "properties": {
        "product": { "type": "string" },
        "odds": { "$ref": "#/definitions/oddsString" }
      },
      "required": [
        "product",
        "odds"
      ],
      "additionalProperties": false
    },
    "attributeNotePair": {
      "type": "object",
      "properties": {
        "attribute": { "$ref": "#/definitions/nonEmptyString" },
        "note": { "$ref": "#/definitions/nonEmptyString" }
      },
      "required": [
        "attribute",
        "note"
      ],
      "additionalProperties": false
    },
    "variation": {
      "type": "object",
      "properties": {
        "variation": { "$ref": "#/definitions/nonEmptyString" },
        "note": { "$ref": "#/definitions/nonEmptyString" },
        "insertOdds": {
          "type": "array",
          "items": { "$ref": "#/definitions/productOdds" }
        },
        "parallels": {
          "type": "array",
          "items": { "$ref": "#/definitions/parallel" }
        },
        "attributes": {
          "type": "array",
          "items": { "$ref": "#/definitions/nonEmptyString" }
        },
        "numberedTo": {
          "type": "integer",
          "minimum": 1
        }
      },
      "required": [
        "variation"
      ],
      "additionalProperties": false
    },
    "parallel": {
      "type": "object",
      "properties": {
        "name": { "$ref": "#/definitions/nonEmptyString" },
        "numberedTo": {
          "type": "integer",
          "minimum": 1
        },
        "notes": {
          "type": "array",
          "items": { "$ref": "#/definitions/nonEmptyString" }
        },
        "insertOdds": {
          "type": "array",
          "items": { "$ref": "#/definitions/productOdds" }
        }
      },
      "required": [
        "name"
      ],
      "additionalProperties": false
    },
    "card": {
      "type": "object",
      "properties": {
        "uniqueId": { "$ref": "#/definitions/uuid" },
        "number": {
          "type": "string",
          "pattern": "^[a-zA-Z0-9 .-]*$"
        },
        "name": { "$ref": "#/definitions/nonEmptyString" },
        "attributes": {
          "type": "array",
          "items": { "$ref": "#/definitions/nonEmptyString" }
        },
        "insertOdds": {
          "type": "array",
          "items": { "$ref": "#/definitions/productOdds" }
        },
        "note": { "$ref": "#/definitions/nonEmptyString" },
        "variations": {
          "type": "array",
          "items": { "$ref": "#/definitions/variation" }
        },
        "parallels": {
          "type": "array",
          "items": { "$ref": "#/definitions/parallel" }
        },
        "numberedTo": {
          "type": "integer",
          "minimum": 1
        }
      },
      "required": [
        "uniqueId",
        "name"
      ],
      "additionalProperties": false
    },
    "set": {
      "type": "object",
      "properties": {
        "uniqueId": { "$ref": "#/definitions/uuid" },
        "name": { "$ref": "#/definitions/nonEmptyString" },
        "notes": {
          "type": "array",
          "items": { "$ref": "#/definitions/nonEmptyString" }
        },
        "numberedTo": {
          "type": "integer",
          "minimum": 1
        },
        "insertOdds": {
          "type": "array",
          "items": { "$ref": "#/definitions/productOdds" }
        },
        "variations": {
          "type": "array",
          "items": { "$ref": "#/definitions/variation" }
        },
        "parallels": {
          "type": "array",
          "items": { "$ref": "#/definitions/parallel" }
        },
        "attributes": {
          "type": "array",
          "items": { "$ref": "#/definitions/nonEmptyString" }
        },
        "cards": {
          "type": "array",
          "items": { "$ref": "#/definitions/card" }
        }
      },
      "required": [
        "uniqueId",
        "name",
        "cards"
      ],
      "additionalProperties": false
    }
  },
  "type": "object",
  "properties": {
    "$schema": {
      "type": "string",
      "format": "uri"
    },
    "name": { "$ref": "#/definitions/nonEmptyString" },
    "version": { "$ref": "#/definitions/versionString" },
    "uniqueId": { "$ref": "#/definitions/uuid" },
    "attributes": {
      "type": "array",
      "items": { "$ref": "#/definitions/attributeNotePair" }
    },
    "notes": {
      "type": "array",
      "items": { "$ref": "#/definitions/nonEmptyString" }
    },
    "sets": {
      "type": "array",
      "items": { "$ref": "#/definitions/set" }
    }
  },
  "required": [
    "$schema",
    "name",
    "version",
    "uniqueId",
    "sets"
  ],
  "additionalProperties": false
}